{
  "id": "darkcipher.gallery.stacks-claude-gateway",
  "name": "Claude Code local-gateway stacks (Experimental)",
  "publisher": "DarkCipher Systems",
  "version": "1.0.0",
  "description": "Data only: Claude Code through the Ollama Anthropic-compatible gateway with tool-capable local models. Experimental and not supported by Anthropic; run the gateway test first. Runs no code.",
  "minAppVersion": "0.1.9",
  "maxTestedVersion": "0.1.9",
  "sdkVersion": "1.1.0",
  "entryPoint": null,
  "types": ["StackTemplate"],
  "permissions": [],
  "requiredServices": [],
  "networkEndpoints": [],
  "dependencies": [],
  "license": "MIT",
  "source": null,
  "signature": null,
  "contributes": { "stackTemplates": ["templates/stacks.json"], "modelCatalogs": [] }
}