{
  "id": "com.example.model-panel",
  "name": "Model summary panel",
  "publisher": "Example Labs",
  "version": "1.0.0",
  "description": "Code sample: a dashboard panel summarising installed models (read-only).",
  "minAppVersion": "0.1.0",
  "maxTestedVersion": "0.1.0",
  "sdkVersion": "1.0.0",
  "entryPoint": "ModelPanel.dll!Sample.ModelPanel.Entry",
  "types": ["DashboardPanel"],
  "permissions": ["ModelManagement", "UI"],
  "requiredServices": [],
  "networkEndpoints": [],
  "dependencies": [],
  "license": "MIT",
  "source": null,
  "signature": null,
  "contributes": { "stackTemplates": [], "modelCatalogs": [] }
}
