{
  "id": "darkcipher.gallery.stacks-web",
  "name": "Web and TypeScript stacks",
  "publisher": "DarkCipher Systems",
  "version": "1.0.0",
  "description": "Data only: Codex + Ollama stacks for TypeScript, React and Node.js projects. Runs no code.",
  "minAppVersion": "0.1.9",
  "maxTestedVersion": "0.1.9",
  "sdkVersion": "1.1.0",
  "entryPoint": null,
  "types": ["StackTemplate"],
  "permissions": [],
  "requiredServices": [],
  "networkEndpoints": [],
  "dependencies": [],
  "license": "MIT",
  "source": null,
  "signature": null,
  "contributes": { "stackTemplates": ["templates/stacks.json"], "modelCatalogs": [] }
}